{
  "contract_id": "simulated-account-head",
  "schema_version": "1.0.0",
  "account_id": "paper-main",
  "account_sequence": 1,
  "state_id": "paper-main-2026-08-18-seq1",
  "state_sha256": "aaaaaaaaaaaaaaaaaaaaaaaaaaaaaaaaaaaaaaaaaaaaaaaaaaaaaaaaaaaaaaaa",
  "previous_state_sha256": null,
  "as_of": "2026-08-18",
  "generated_at": "2026-08-18T09:31:00+08:00"
}
